[
  {
    "id": "hints.bridge.j1",
    "version": 1,
    "solution_allowed_after": 3,
    "status": "draft",
    "levels": [
      { "level": 1, "type": "ask", "text_key": "hints.bridge.j1.1" },
      { "level": 2, "type": "hint", "text_key": "hints.bridge.j1.2" },
      { "level": 3, "type": "smaller_hint", "text_key": "hints.bridge.j1.3" },
      { "level": 4, "type": "demonstrate", "text_key": "hints.bridge.j1.4" },
      { "level": 5, "type": "explain", "text_key": "hints.bridge.j1.5" }
    ]
  },
  {
    "id": "hints.bridge.j2",
    "version": 1,
    "solution_allowed_after": 3,
    "status": "draft",
    "levels": [
      { "level": 1, "type": "ask", "text_key": "hints.bridge.j2.1" },
      { "level": 2, "type": "hint", "text_key": "hints.bridge.j2.2" },
      { "level": 3, "type": "smaller_hint", "text_key": "hints.bridge.j2.3" },
      { "level": 4, "type": "demonstrate", "text_key": "hints.bridge.j2.4" },
      { "level": 5, "type": "explain", "text_key": "hints.bridge.j2.5" }
    ]
  },
  {
    "id": "hints.bridge.j3",
    "version": 1,
    "solution_allowed_after": 3,
    "status": "draft",
    "levels": [
      { "level": 1, "type": "ask", "text_key": "hints.bridge.j3.1" },
      { "level": 2, "type": "hint", "text_key": "hints.bridge.j3.2" },
      { "level": 3, "type": "smaller_hint", "text_key": "hints.bridge.j3.3" },
      { "level": 4, "type": "demonstrate", "text_key": "hints.bridge.j3.4" },
      { "level": 5, "type": "explain", "text_key": "hints.bridge.j3.5" }
    ]
  },
  {
    "id": "hints.bridge.j4",
    "version": 1,
    "solution_allowed_after": 3,
    "status": "draft",
    "levels": [
      { "level": 1, "type": "ask", "text_key": "hints.bridge.j4.1" },
      { "level": 2, "type": "hint", "text_key": "hints.bridge.j4.2" },
      { "level": 3, "type": "smaller_hint", "text_key": "hints.bridge.j4.3" },
      { "level": 4, "type": "demonstrate", "text_key": "hints.bridge.j4.4" },
      { "level": 5, "type": "explain", "text_key": "hints.bridge.j4.5" }
    ]
  },
  {
    "id": "hints.bridge.j5",
    "version": 1,
    "solution_allowed_after": 3,
    "status": "draft",
    "levels": [
      { "level": 1, "type": "ask", "text_key": "hints.bridge.j5.1" },
      { "level": 2, "type": "hint", "text_key": "hints.bridge.j5.2" },
      { "level": 3, "type": "smaller_hint", "text_key": "hints.bridge.j5.3" },
      { "level": 4, "type": "demonstrate", "text_key": "hints.bridge.j5.4" },
      { "level": 5, "type": "explain", "text_key": "hints.bridge.j5.5" }
    ]
  },
  {
    "id": "hints.bridge.e1",
    "version": 1,
    "solution_allowed_after": 3,
    "status": "draft",
    "levels": [
      { "level": 1, "type": "ask", "text_key": "hints.bridge.e1.1" },
      { "level": 2, "type": "hint", "text_key": "hints.bridge.e1.2" },
      { "level": 3, "type": "smaller_hint", "text_key": "hints.bridge.e1.3" },
      { "level": 4, "type": "demonstrate", "text_key": "hints.bridge.e1.4" },
      { "level": 5, "type": "explain", "text_key": "hints.bridge.e1.5" }
    ]
  },
  {
    "id": "hints.bridge.e2",
    "version": 1,
    "solution_allowed_after": 3,
    "status": "draft",
    "levels": [
      { "level": 1, "type": "ask", "text_key": "hints.bridge.e2.1" },
      { "level": 2, "type": "hint", "text_key": "hints.bridge.e2.2" },
      { "level": 3, "type": "smaller_hint", "text_key": "hints.bridge.e2.3" },
      { "level": 4, "type": "demonstrate", "text_key": "hints.bridge.e2.4" },
      { "level": 5, "type": "explain", "text_key": "hints.bridge.e2.5" }
    ]
  },
  {
    "id": "hints.bridge.e3",
    "version": 1,
    "solution_allowed_after": 3,
    "status": "draft",
    "levels": [
      { "level": 1, "type": "ask", "text_key": "hints.bridge.e3.1" },
      { "level": 2, "type": "hint", "text_key": "hints.bridge.e3.2" },
      { "level": 3, "type": "smaller_hint", "text_key": "hints.bridge.e3.3" },
      { "level": 4, "type": "demonstrate", "text_key": "hints.bridge.e3.4" },
      { "level": 5, "type": "explain", "text_key": "hints.bridge.e3.5" }
    ]
  },
  {
    "id": "hints.bridge.e4",
    "version": 1,
    "solution_allowed_after": 3,
    "status": "draft",
    "levels": [
      { "level": 1, "type": "ask", "text_key": "hints.bridge.e4.1" },
      { "level": 2, "type": "hint", "text_key": "hints.bridge.e4.2" },
      { "level": 3, "type": "smaller_hint", "text_key": "hints.bridge.e4.3" },
      { "level": 4, "type": "demonstrate", "text_key": "hints.bridge.e4.4" },
      { "level": 5, "type": "explain", "text_key": "hints.bridge.e4.5" }
    ]
  },
  {
    "id": "hints.bridge.e5",
    "version": 1,
    "solution_allowed_after": 3,
    "status": "draft",
    "levels": [
      { "level": 1, "type": "ask", "text_key": "hints.bridge.e5.1" },
      { "level": 2, "type": "hint", "text_key": "hints.bridge.e5.2" },
      { "level": 3, "type": "smaller_hint", "text_key": "hints.bridge.e5.3" },
      { "level": 4, "type": "demonstrate", "text_key": "hints.bridge.e5.4" },
      { "level": 5, "type": "explain", "text_key": "hints.bridge.e5.5" }
    ]
  },
  {
    "id": "hints.bridge.m1",
    "version": 1,
    "solution_allowed_after": 3,
    "status": "draft",
    "levels": [
      { "level": 1, "type": "ask", "text_key": "hints.bridge.m1.1" },
      { "level": 2, "type": "hint", "text_key": "hints.bridge.m1.2" },
      { "level": 3, "type": "smaller_hint", "text_key": "hints.bridge.m1.3" },
      { "level": 4, "type": "demonstrate", "text_key": "hints.bridge.m1.4" },
      { "level": 5, "type": "explain", "text_key": "hints.bridge.m1.5" }
    ]
  },
  {
    "id": "hints.bridge.m2",
    "version": 1,
    "solution_allowed_after": 3,
    "status": "draft",
    "levels": [
      { "level": 1, "type": "ask", "text_key": "hints.bridge.m2.1" },
      { "level": 2, "type": "hint", "text_key": "hints.bridge.m2.2" },
      { "level": 3, "type": "smaller_hint", "text_key": "hints.bridge.m2.3" },
      { "level": 4, "type": "demonstrate", "text_key": "hints.bridge.m2.4" },
      { "level": 5, "type": "explain", "text_key": "hints.bridge.m2.5" }
    ]
  },
  {
    "id": "hints.bridge.m3",
    "version": 1,
    "solution_allowed_after": 3,
    "status": "draft",
    "levels": [
      { "level": 1, "type": "ask", "text_key": "hints.bridge.m3.1" },
      { "level": 2, "type": "hint", "text_key": "hints.bridge.m3.2" },
      { "level": 3, "type": "smaller_hint", "text_key": "hints.bridge.m3.3" },
      { "level": 4, "type": "demonstrate", "text_key": "hints.bridge.m3.4" },
      { "level": 5, "type": "explain", "text_key": "hints.bridge.m3.5" }
    ]
  },
  {
    "id": "hints.bridge.m4",
    "version": 1,
    "solution_allowed_after": 3,
    "status": "draft",
    "levels": [
      { "level": 1, "type": "ask", "text_key": "hints.bridge.m4.1" },
      { "level": 2, "type": "hint", "text_key": "hints.bridge.m4.2" },
      { "level": 3, "type": "smaller_hint", "text_key": "hints.bridge.m4.3" },
      { "level": 4, "type": "demonstrate", "text_key": "hints.bridge.m4.4" },
      { "level": 5, "type": "explain", "text_key": "hints.bridge.m4.5" }
    ]
  },
  {
    "id": "hints.bridge.m5",
    "version": 1,
    "solution_allowed_after": 3,
    "status": "draft",
    "levels": [
      { "level": 1, "type": "ask", "text_key": "hints.bridge.m5.1" },
      { "level": 2, "type": "hint", "text_key": "hints.bridge.m5.2" },
      { "level": 3, "type": "smaller_hint", "text_key": "hints.bridge.m5.3" },
      { "level": 4, "type": "demonstrate", "text_key": "hints.bridge.m5.4" },
      { "level": 5, "type": "explain", "text_key": "hints.bridge.m5.5" }
    ]
  }
]
